<?xml version="1.0" encoding="utf-8"?>
<xs:schema xmlns:xsi="http://www.w3.org/2001/XMLSchema-instance" attributeFormDefault="unqualified" elementFormDefault="qualified" xmlns:xs="http://www.w3.org/2001/XMLSchema">
  <xs:element name="livros">
    <xs:complexType>
      <xs:sequence>
        <xs:element maxOccurs="unbounded" name="livro">
          <xs:complexType>
            <xs:sequence>
              <xs:element name="titulo" type="xs:string" />
              <xs:element name="autor" type="xs:string" />
              <xs:element name="editora" type="xs:string" />
            </xs:sequence>
            <xs:attribute name="isbn" type="xs:unsignedByte" use="optional" />
          </xs:complexType>
        </xs:element>
      </xs:sequence>
    </xs:complexType>
  </xs:element>
</xs:schema>